[
  {
    "symbol": "TSLA",
    "price": 391.09,
    "change": -4.14,
    "change_percent": -1.05,
    "sentiment": "negative",
    "volume": 0,
    "market_cap": 0,
    "last_updated": "2025-11-23T21:38:29.716285Z"
  },
  {
    "symbol": "NVDA",
    "price": 178.88,
    "change": -1.76,
    "change_percent": -0.97,
    "sentiment": "negative",
    "volume": 0,
    "market_cap": 0,
    "last_updated": "2025-11-23T21:38:30.258182Z"
  },
  {
    "symbol": "META",
    "price": 594.25,
    "change": 5.1,
    "change_percent": 0.87,
    "sentiment": "positive",
    "volume": 0,
    "market_cap": 0,
    "last_updated": "2025-11-23T21:38:30.789204Z"
  },
  {
    "symbol": "SPY",
    "price": 659.03,
    "change": 6.5,
    "change_percent": 1.0,
    "sentiment": "positive",
    "volume": 0,
    "market_cap": 0,
    "last_updated": "2025-11-23T21:38:31.328488Z"
  },
  {
    "symbol": "GLD",
    "price": 374.27,
    "change": -0.58,
    "change_percent": -0.15,
    "sentiment": "negative",
    "volume": 0,
    "market_cap": 0,
    "last_updated": "2025-11-23T21:38:31.871288Z"
  },
  {
    "symbol": "AAPL",
    "price": 271.49,
    "change": 5.24,
    "change_percent": 1.97,
    "sentiment": "positive",
    "volume": 0,
    "market_cap": 0,
    "last_updated": "2025-11-23T21:38:32.406176Z"
  },
  {
    "symbol": "MSFT",
    "price": 472.12,
    "change": -6.31,
    "change_percent": -1.32,
    "sentiment": "negative",
    "volume": 0,
    "market_cap": 0,
    "last_updated": "2025-11-23T21:38:32.929256Z"
  },
  {
    "symbol": "AMZN",
    "price": 220.69,
    "change": 3.55,
    "change_percent": 1.63,
    "sentiment": "positive",
    "volume": 0,
    "market_cap": 0,
    "last_updated": "2025-11-23T21:38:33.487517Z"
  }
]